{
  "$schema": "../../schemas/evidence_review_runtime_manifest_v1.schema.json",
  "accept_count": 27,
  "execution_config": {
    "api_mode": "ollama_api_chat",
    "contract_version": "retrieval_evidence_review_contract_v2",
    "endpoint": "http://127.0.0.1:11434",
    "num_predict": 512,
    "prompt_version": "evidence_review_prompt_v1",
    "seed": 42,
    "structured_output_schema_version": "evidence_review_response_v1",
    "temperature": 0.0
  },
  "failure_count": 0,
  "input_sha256": {
    "contract": "8a55dc8a37e1c37ec3b4a070c8d6feac4be80fc542bd9a6e80e3613f9c29de97",
    "contracts_module": "aab63806d4a8f774b2a551b6b3431dc940236851a931b5d9cd047d5eb38c2ee5",
    "manifest_schema": "dfb41a2cf4efcd248576a4686ab77575097e50da50ff8c0111705a3017a178e1",
    "ollama_adapter": "dace17dee2e82ad8a738570ec6310d7051f38dd303bc2c71bf6e0d9979721a85",
    "prompt_module": "c8aea644bf3d6b41c8bdfd5f3f0918794be58700de065d892a1b96e5082e5f6a",
    "provider_protocol": "5ff3923d5bb308728046649b3fb4061fa6c40bff6c50daf4dcfd2ee7358507d2",
    "request_package": "1cafc735ec5a40cf0179c017f064dd9cd3d187f0a4b90564d68680928e257a3e",
    "request_schema": "23097956afea34171350b8ea1897f6c347ace1c2adafd0fe7de78ea4fc1a0da3",
    "response_schema": "ce7dd6aafe3667f9fbc33b097d1a6747c2eb165a7bc02034da23a1336a0133cf",
    "runtime_script": "1606a452506be4128d837706ff527a0fd4381d1499851c9edd3503db91b92c25"
  },
  "output_artifacts": [
    {
      "file": "evaluation/review/evidence_accept_reject/ollama_llama32_3b_reviews_v1.jsonl",
      "sha256": "6484bf5adcec31de7f19c4015b6f3aa4ab864237bd1de579505e7c0633a01ce0"
    },
    {
      "file": "reports/14_evidence_review_runtime/evidence_review_runtime_validation.csv",
      "sha256": "a450f3cb19a70dc8afda262d51afde52864dcfdf70391dee8d1715726d2c73b3"
    }
  ],
  "provider": "ollama",
  "question_count": 40,
  "reject_count": 13,
  "runtime": {
    "digest": "a80c4f17acd55265feec403c7aef86be0c25983ab279d83f3bcd3abbcb5b8b72",
    "family": "llama",
    "model": "llama3.2:3b",
    "ollama_version": "0.32.13",
    "parameter_size": "3.2B",
    "quantization_level": "Q4_K_M",
    "size_bytes": 2019393189
  },
  "runtime_run_id": "mit60001_evidence_reviewer_0ee5e6a1362fc5c4",
  "schema_version": "evidence_review_runtime_manifest_v1",
  "validation_status": "passed"
}
